"0","913","4","Ahead citizen value more face responsibility charge story sense we ten production.","2015-05-28 15:50:44"
"1","575","1","Public story politics suffer television seat main husband.","2014-07-08 10:59:07"
"2","465","1","Line gun account difficult food day.","2020-05-04 04:48:11"
"2","1171","5","Bring shake situation degree night blood network idea prove whose class child me.","2000-09-15 12:45:36"
"1","980","4","Enough raise space without strategy computer defense about.","2013-07-27 20:58:46"
"2","1989","1","Term of line specific everyone need chance good shoulder order enter.","2021-08-27 17:27:17"
"0","291","3","Away reason million why hit which.","2010-09-21 00:34:35"
"1","831","1","Trial week light tax imagine here rock wife detail ball provide indeed reduce.","2009-06-07 18:35:39"
"2","660","2","Pull woman audience suggest send rock road.","2020-07-27 15:56:18"
"3","1677","3","This rich board commercial drive notice hot learn along.","2008-03-04 05:06:32"
"3","1409","4","Sea interview building herself technology popular generation produce live suffer decide window future.","2003-04-04 02:14:08"
"0","870","1","Dinner read behavior several enter term budget ahead impact step toward participant.","2002-07-02 00:11:44"
"1","406","3","Eye who bring your cultural experience your site.","2022-03-31 16:33:27"
"0","1184","3","Rich measure opportunity article center produce shoulder level model.","2010-02-24 14:01:11"
"2","444","1","Think itself child eight science the pressure head.","2010-08-30 07:55:32"
"1","1447","5","Political party lose live despite month during especially.","2015-09-07 10:19:58"
"2","812","3","Help help drive for enough others affect interest natural maybe left loss their.","2012-05-12 04:17:53"
"2","1735","5","Community news environmental despite foot fear reduce.","2004-09-25 17:34:25"
"3","720","1","Else she former cultural development least drop within amount.","2015-05-31 23:57:09"
"2","789","3","Wish third pattern seat father popular.","2016-12-02 00:55:50"
"3","864","3","Offer as show itself herself kind not back standard direction adult.","2007-03-12 16:56:45"
"1","1985","4","Maintain near hear let campaign fear second time only size too collection most.","2015-10-18 21:53:22"
"1","49","1","Determine court according reason student defense.","2017-02-15 13:45:35"
"1","1847","5","He against father campaign who benefit prepare vote a attention little.","2008-10-14 21:30:10"
"3","943","3","Simple score career already detail author eye break or left.","2000-05-14 00:55:33"
"2","1854","2","Fire amount look author through high.","2013-02-24 22:59:20"
"2","35","2","Finish concern activity year certainly two.","2006-02-17 02:12:26"
"0","1840","5","Here organization however majority discover line like.","2022-08-16 08:37:10"
"1","567","4","Attention first church management produce trouble you daughter record nor painting.","2002-03-25 17:33:20"
"2","1499","3","Make a lead business identify voice idea.","2003-10-12 14:16:02"
"3","1264","5","Check alone table size campaign off seek begin no.","2020-08-14 14:08:26"
"1","1461","4","Around offer beautiful nice then down.","2003-11-28 21:16:29"
"0","1388","3","Deal building skill lay weight around quite.","2005-02-23 16:44:58"
"3","1411","2","Question simply yourself free at team friend Congress prepare reveal a.","2011-05-08 14:33:09"
"3","1602","4","Street about fire station between fall laugh administration smile for long enough.","2001-10-18 16:11:37"
"3","1381","1","Staff chance simply can exist should someone American position.","2012-10-08 12:57:40"
"3","1736","5","Meet peace compare hold all thing sport none leave oil them parent blood.","2002-06-03 21:54:07"
"3","1851","4","Real fund PM rather arm end.","2017-11-14 04:36:18"
"3","1556","3","Discuss maintain computer simple no article method.","2006-10-15 22:56:46"
"0","1877","4","Avoid reason say water take list owner leader strong half town against fire drop.","2007-11-10 02:48:41"
"0","1736","4","Bring prepare job behind would nearly be who full.","2013-07-30 21:32:54"
"0","1960","4","Property back resource until model surface star customer vote cell spring talk.","2008-02-20 10:34:35"
"0","1123","5","Debate so act along movement kitchen raise people bad rest onto generation.","2007-08-17 02:35:45"
"0","662","4","Culture reality foot issue much role late international.","2005-10-18 21:03:41"
"2","1968","1","Company another every culture glass work million energy stay address much us affect.","2002-02-18 03:18:33"
"1","1458","2","Natural home record rule arrive something manager.","2009-02-05 13:00:57"
"1","471","5","Fight toward ten while total purpose light especially.","2001-02-15 07:37:42"
"2","321","3","From seem investment next anything doctor control as from cause everybody behavior.","2020-07-21 08:15:33"
"1","1228","1","Raise own build wonder TV low actually actually reduce official network inside.","2012-11-05 16:15:08"
"2","237","5","Nor toward safe action get light several two group.","2022-06-19 20:08:00"
"0","821","4","How condition news among training marriage past write draw nothing watch.","2000-05-17 12:34:16"
"3","772","4","Early happy both agent edge old drug.","2005-06-15 21:57:02"
"1","851","1","Laugh former anything business wrong candidate.","2007-09-02 01:34:32"
"1","1335","5","Ground address bar final open we able stage time.","2020-06-26 14:56:41"
"1","1468","3","It keep maintain nation sell begin general suddenly foot art knowledge.","2010-06-05 18:33:43"
"2","1594","3","Student shoulder store send program way behind visit scene push ground.","2017-05-07 14:28:16"
"0","365","3","East notice girl along last hair.","2003-10-29 09:17:11"
"2","225","5","Perform animal say across this happen here American.","2014-10-07 05:49:43"
"0","1916","4","Provide Mrs left tend indeed civil big best.","2021-06-16 13:11:54"
"3","861","5","Help amount teacher themselves million seven coach manager spring.","2004-10-28 17:05:31"
"0","1134","2","Letter yourself evidence save would wind note left.","2000-05-16 08:11:20"
"3","522","5","Answer set always movie letter cup toward land defense move.","2018-04-19 03:18:30"
"2","1928","3","Standard dream this many drug area however watch throw magazine heart decide.","2002-07-12 10:20:45"
"1","16","4","Nothing these involve remain born commercial economic fire line inside foreign according finish.","2021-10-22 06:06:31"
"1","862","5","Body treat resource as doctor task lead score other successful provide happen maybe.","2020-03-25 06:55:08"
"3","1927","3","Perform parent summer special night including.","2002-06-10 11:22:45"
"1","458","2","Fast sell police project night side realize all because law red everyone.","2008-01-12 07:08:37"
"3","635","2","Oil fund bar wind computer two prevent.","2021-02-06 05:42:34"
"3","1693","2","Operation around meeting product game shoulder.","2014-04-09 22:01:55"
"3","1617","5","Fall color product product once never character follow.","2016-10-09 03:08:25"
"3","466","5","Pressure arm vote already place brother American talk enough their cell.","2008-12-05 10:27:33"
"2","1925","2","Letter person position pay interest something too.","2001-11-08 07:43:09"
"2","438","5","Hundred when day thought letter leg within small decision president.","2003-12-18 19:01:16"
"1","1550","5","Have analysis whether center short while.","2011-08-30 17:51:36"
"3","492","4","Third center person so natural outside.","2011-12-22 08:04:20"
"3","1069","4","Game sell increase successful performance brother religious understand walk stage.","2000-10-02 22:19:49"
"3","1584","1","Law media camera herself begin safe west.","2005-06-30 12:59:04"
"2","50","1","If its much will help close back real film finally eat statement.","2021-03-03 19:43:35"
"0","751","2","Language meet training for believe agent likely.","2013-06-02 01:29:53"
"3","981","1","Arm arm type will three act source prove own owner travel.","2011-02-09 22:01:30"
"1","97","1","Member firm language media right executive live type.","2013-05-04 18:40:23"
"1","1902","2","Bill discuss population hit include magazine floor institution company official no difficult.","2019-01-08 17:54:50"
"3","735","1","Natural each coach building fish week thus.","2007-10-08 23:08:38"
"1","1189","3","Sister yet number affect political message personal night Mr.","2010-02-09 21:32:16"
"3","593","1","Perform year lead debate him television stop choice.","2015-03-16 06:33:34"
"1","1444","4","Senior star toward direction hotel still sing position stock man magazine.","2014-06-18 00:17:01"
"2","773","2","Analysis share attorney those want news company same.","2016-05-05 14:57:22"
"0","1821","4","Degree model gas best party up tough likely surface only attention allow.","2021-09-14 22:02:33"
"2","79","3","Especially point trial raise school explain.","2016-06-24 18:56:41"
"0","350","5","Cover go operation rest peace religious become as occur family.","2008-08-20 16:59:34"
"1","533","1","Example watch television stage hard new color impact name their she year build.","2019-02-12 04:38:00"
"0","656","4","Accept stuff guess senior fact vote southern.","2000-04-20 00:11:48"
"1","258","2","Care anyone especially positive site medical game them.","2015-12-31 14:48:47"
"0","1756","1","Himself new even debate plant mind within thing nation natural health price lot.","2001-10-20 13:28:29"
"3","1391","4","Might through these identify hundred hair team mouth information friend audience.","2019-10-20 18:54:12"
"3","307","1","I great on value anyone me.","2005-11-08 17:14:03"
"3","1773","5","Participant pay conference information term general.","2018-01-02 23:26:29"
"1","1641","2","Goal oil pass form necessary describe between.","2006-11-02 20:47:20"
"2","1348","4","Consumer theory catch effect ready indicate.","2014-03-24 20:46:22"
"2","190","2","History method woman guy wife federal party manage summer.","2013-11-08 20:48:49"
"1","545","4","Student recently set any red add page against.","2010-11-13 01:58:59"
"3","1177","3","Create base western line note tend white.","2004-02-21 16:37:59"
"3","885","3","Positive song indeed at nothing participant only big daughter.","2012-04-02 12:43:13"
"3","428","4","Partner dog five wait product require area and bill military successful our himself.","2018-10-10 14:32:39"
"1","1452","2","As care poor growth reveal money discover gun including since work include its.","2009-10-08 03:50:46"
"0","1322","5","Carry federal concern usually remember others institution join memory moment between section.","2001-08-22 20:03:30"
"0","424","1","Alone why perform maintain picture process cold all number continue conference.","2011-05-24 03:35:03"
"1","467","1","Natural leg late option cup could street above institution agree month someone with.","2016-04-15 10:20:31"
"3","1718","5","Most become language kid various without public cost stay without.","2002-10-17 09:49:43"
"2","147","3","Discussion seat fact my laugh opportunity remember.","2011-06-17 03:09:48"
"0","536","1","Responsibility stop physical former reduce social indicate who picture operation author fact century.","2006-09-08 14:13:10"
"1","490","3","Same available art above hour reason rate plant gun evidence impact simple.","2013-04-08 23:33:58"
"2","738","3","Five movement live clearly artist relate education.","2002-11-30 01:43:24"
"1","742","5","Page image know likely area city of.","2004-09-25 13:55:11"
"1","374","3","A news office year military expect society.","2002-09-21 19:55:58"
"0","536","3","Dark into series run report could dog.","2001-12-10 06:06:04"
"3","1645","2","Language choose citizen later arm how listen.","2000-03-31 10:58:55"
"1","1633","2","Name other thus thing discuss however south.","2002-10-07 21:51:26"
"2","312","4","Go right professional natural idea read go dream.","2004-01-24 07:00:37"
"3","119","1","Person line tonight lawyer at drive church fall.","2007-03-29 10:04:37"
"1","1843","4","To democratic deep coach appear everyone author born only trouble deal move.","2001-07-28 05:40:35"
"0","263","3","Audience bar still outside itself way walk itself strategy assume mention firm best.","2012-01-11 04:41:05"
"3","799","4","Page card safe role decide really child cut development always stuff thank movie.","2005-08-07 18:55:17"
"1","107","2","Scene road relationship song whether deep human its defense beat section.","2013-05-10 14:30:42"
"0","1830","4","Military office participant produce than its foreign.","2020-05-18 08:17:23"
"1","536","5","Less fall across join stop amount make recently claim.","2001-07-17 19:58:01"
"3","1263","5","Center less TV building choose court these summer.","2020-11-16 00:56:57"
"3","69","3","Others red step near firm really girl ask society land evening but traditional.","2011-05-03 14:32:50"
"3","1541","5","Hope different sort quality level exist.","2018-05-03 22:34:23"
"3","624","3","During yeah amount clearly bring same possible particularly.","2017-08-19 12:49:51"
"1","906","4","Environmental once second ok college easy who rather attorney second.","2008-03-12 14:57:45"
"0","68","4","Simply year brother partner vote my free piece answer explain report as everything.","2011-06-14 02:04:45"
"0","1654","1","Both here adult do material different.","2000-12-08 05:47:47"
"3","45","2","Even piece pull guy exist role.","2012-07-10 06:33:33"
"2","1012","2","Ok drop easy both by note suggest left say left.","2021-04-04 00:38:07"
"0","1267","2","Car break true property admit culture.","2004-11-03 18:41:06"
"2","471","5","Night lay process first structure level health expert strategy next.","2020-02-04 01:08:19"
"2","648","4","Similar building I wait window material black site safe final.","2017-05-02 01:40:20"
"1","1849","3","Never present arm total sort various ability newspaper time.","2003-06-04 23:14:43"
"2","673","5","Glass week perhaps none nor western foot continue season goal happy.","2020-12-26 21:29:25"
"1","768","5","Guess sometimes put green produce tend line summer claim current.","2015-07-07 07:57:21"
"0","494","3","Should name one open organization mention to can together focus town attack name.","2017-09-10 22:48:30"
"3","539","1","Fine meet them measure consumer however strong me time rule accept listen.","2002-05-24 17:46:27"
