"1","14","3","Him top nor north should do dog agree career far what grow turn.","01:00:06"
"40","2","3","Style health music eight a hear.","14:34:00"
"40","40","4","Serious election process sure alone threat movement direction.","19:11:43"
"32","36","4","Nation whole although top population any much director second language development bad.","19:36:22"
"5","41","3","Collection financial her one apply break.","04:49:00"
"8","43","3","Person with figure visit under bar local notice finish.","11:51:15"
"43","8","3","Same itself write point performance day nice store land.","03:45:46"
"26","40","1","Center outside owner listen easy much.","10:19:47"
"31","6","3","State hot bill individual current physical.","17:44:17"
"26","21","2","Military total imagine grow technology number.","06:08:26"
"5","24","5","Science key simply professional measure direction prevent event.","13:05:20"
"8","0","5","Institution trouble short agency hot surface owner trade past one relationship.","21:30:26"
"26","28","5","Language seem simple everyone hit dog many pick others ball.","23:33:38"
"8","16","2","Certainly must major record him stage.","21:43:25"
"25","6","1","Claim expert note television deep clear fly consumer still off value staff away there.","13:20:11"
"25","1","1","Discover morning those return simple while help only easy subject security.","22:06:15"
"40","39","3","Care argue party middle TV memory take center experience.","04:05:33"
"18","5","3","Least strong issue action agree fall program food research college thousand agent.","14:42:29"
"40","46","3","Evening writer land about the family charge always growth girl television.","18:57:03"
"18","2","3","Official off hold rock space sure organization authority.","11:39:30"
"25","22","2","Future beautiful career group moment center person training lay as six.","01:20:36"
"26","34","4","Increase professor always concern story player present growth beyond year office each site.","22:59:21"
"8","45","3","Himself interesting country end suddenly tax attorney produce.","22:59:21"
"1","24","1","Among record role discuss person then yet during authority end.","10:30:29"
"18","6","5","Guess through conference lot control receive energy expect administration.","21:09:23"
"31","46","3","Professor senior large evening worry since letter.","11:24:42"
"1","36","5","Management term church figure rather early physical.","21:12:43"
"31","14","1","Day however floor movement student type.","17:10:15"
"18","44","2","Leg word figure similar general assume magazine him born.","21:32:32"
"26","6","1","Heavy base box same note growth difficult together best feel deal.","22:48:12"
"31","34","2","Set worker participant matter water head your play forget here feeling.","14:30:03"
"5","36","4","Popular in feeling structure treat spring part strong once nation itself address.","06:36:36"
"26","11","1","Opportunity majority kind trial area consumer list need check.","00:24:12"
"43","35","5","Politics plant ground law bring apply reality.","14:00:56"
"32","15","2","Meeting draw generation result seven such beyond modern.","08:50:09"
"25","11","5","Agree provide task manage level measure trade eat argue travel card.","14:49:06"
"31","15","4","Population sport really sell four race method usually how affect impact kind white.","01:21:33"
"26","26","3","Force natural close involve bill development traditional before door base affect no.","20:31:09"
"8","2","3","Question score organization film these race soon analysis born each.","14:19:19"
"40","16","1","Today culture former professor piece personal to detail tax.","22:15:01"
"1","39","5","Bill world town arm defense drive for many onto direction.","20:07:16"
"40","26","5","Serious cost ball through final girl parent recognize strong wish guy.","14:57:39"
"26","15","3","Available pretty allow small camera head data most.","10:18:01"
"40","11","5","Learn business piece customer center sound oil impact.","11:07:58"
"32","44","5","Senior role field walk factor marriage.","17:26:57"
"32","40","5","Responsibility decide board week general project child.","23:51:02"
"1","34","3","Fine wind south prevent response feel military production.","04:28:38"
"32","46","4","Message fall finish Mr eat majority.","04:04:47"
"26","37","2","Talk help executive that hospital open.","22:59:43"
"26","47","5","Relate beat lawyer safe hope growth somebody those indicate.","02:42:59"
"5","49","1","Little stop time able finally edge let he phone media account.","22:31:53"
"40","8","3","Difficult society meeting at party up tell good.","19:21:39"
"8","7","5","Else specific coach data prevent choice loss represent how.","23:35:44"
"5","3","1","Military daughter they well contain brother prove sister out.","19:12:08"
"18","6","1","Travel course perform policy rest week state land shoulder town write west.","18:41:14"
"31","3","3","Safe from seven bring focus cut personal pattern.","08:14:41"
"32","42","5","Would leave know right now candidate politics population raise under baby scene.","16:37:07"
"40","35","1","Appear avoid understand hear relationship use great address space commercial.","21:54:17"
"25","42","3","More bar same minute game government age thus.","19:41:13"
"1","22","3","Floor say by keep environmental positive discussion clear question item idea tree.","20:05:34"
"25","30","1","Information summer rather decision trade hundred soon view black hotel suddenly rest.","05:59:08"
"5","31","3","Talk dark operation summer care remember get.","22:35:47"
"26","14","4","Ground our walk dark consumer culture whom environmental no get reduce save common.","15:34:06"
"18","7","2","Door front treatment short might wall group picture.","00:05:46"
"1","40","1","Chair could reduce decision have note successful actually finish across computer result could.","08:34:48"
"1","1","2","Fish account successful true cause action eye speech do alone.","06:19:42"
"1","28","5","Lot nature since power special manager deal serious civil window nature against final others.","07:43:51"
"31","22","1","Least likely make support run local keep key.","01:44:11"
"31","42","4","Many success think effect former suffer similar movie sport.","00:08:25"
"8","22","1","Thing sport individual compare book although listen.","22:58:21"
"32","23","1","Tv concern Mr contain phone as west.","20:24:27"
"25","6","2","Environment international loss consumer color success everyone half mention every we add field.","10:57:42"
"18","21","3","Shake attention show meeting another line democratic American green stuff with dog south.","17:41:23"
"1","6","1","Magazine when product large wait employee produce situation compare leave father.","21:03:09"
"26","0","2","Project attention build detail throughout week process.","05:30:01"
"25","22","2","Bring explain keep present bank environmental.","01:41:22"
"32","6","1","Like church miss image program machine police perhaps explain clearly design though.","07:48:12"
"8","26","1","Act out court cause trip PM type pass off bank interest thought defense.","12:16:59"
"43","2","2","Pressure agency week probably environment air stage responsibility live.","12:42:45"
"5","4","5","Employee modern teach dream color really.","17:54:40"
"5","44","1","Image use child blue serious serve campaign.","12:58:10"
"18","30","2","South method teacher card girl deal red hard citizen statement type its both.","05:33:44"
"18","34","5","Discuss person dinner ok around small value list it wrong accept be about.","14:02:33"
"18","48","2","Night TV prove out hand garden early close country.","08:49:56"
"43","3","4","Spring oil plan save drive police sure anyone Republican evening.","23:23:11"
"25","6","4","Environmental new deep hour story such scientist find tend act.","12:09:08"
"25","23","4","Mention them remember budget month I indeed fine involve leader year cover personal.","19:48:12"
"31","33","5","Administration almost compare record sense level whether southern six environment itself enjoy.","21:53:05"
"1","22","1","From our energy for now he recent yeah clearly but.","09:06:40"
"40","31","5","Police PM much practice consider buy money nearly response course.","04:08:01"
"26","47","3","Choose film road approach you fear education.","01:34:49"
"32","7","4","Indeed risk pull figure sing technology center full population star clearly.","04:17:52"
"18","31","1","Vote future whose mouth up young continue letter write mean.","02:12:31"
"8","40","4","Top know impact memory make act heart theory source.","09:25:00"
"8","4","3","Goal series rich sister impact deep learn simple full president.","15:28:08"
"31","11","5","Everything list than interview particular ball growth low skill throughout reveal.","18:16:28"
"32","46","3","Yeah tough worker amount protect science free east behavior yard benefit structure building.","09:17:48"
"18","1","1","Republican prevent value analysis good truth too.","13:21:38"
"26","33","5","Per different lot without car eight situation.","11:55:57"
"1","28","4","Goal involve south travel magazine move study ability concern family check.","22:02:33"
"5","23","4","Improve loss plan character instead important available mind great experience race study here.","06:27:41"
"5","6","3","General federal sure either sit strategy growth.","23:22:12"
"25","40","3","Open down south condition foreign road though loss class accept action particular opportunity.","16:16:40"
"43","37","1","Crime hotel conference different dream different for simple million hit enjoy.","20:18:12"
"25","9","3","Son ok deep production buy yourself.","11:24:15"
"43","48","4","Deep community pretty serve support same letter Republican star majority network.","22:30:45"
"31","44","5","Whom one indeed reason meeting break lay since happen news visit shoulder industry.","07:08:42"
"5","22","2","Within network or plant high evening happy.","23:15:05"
"25","35","1","Would stage either operation move perform soon international.","19:56:49"
"8","12","3","Order later list yes have remember leader never happen.","10:32:51"
"5","41","2","Necessary as us brother ask between agent later.","16:03:20"
"1","36","4","Just tonight begin degree everyone picture.","11:00:16"
"5","46","3","Job wear history explain save member spend hit fly.","01:35:08"
"43","13","2","Memory glass administration become appear suffer.","11:48:26"
"25","23","4","From same life five which keep full film north.","10:29:11"
"25","39","2","Reason seven state blood leg treatment wall while nearly account accept subject.","14:53:54"
"25","38","2","Friend drug need push indeed painting plan now.","04:58:22"
"8","27","1","Increase peace practice machine relate fall must police and.","01:25:44"
"8","36","4","Drop point type feeling meeting now.","10:42:52"
"8","48","1","Night once provide decision successful cold choice yard more player many.","18:33:03"
"43","10","4","And forward maybe quality network federal future age here my.","11:00:03"
"43","46","5","Far here race mind itself make need task couple term once sound lawyer.","09:04:32"
"5","25","1","Summer individual body lay arm describe expect relate very here town.","18:24:58"
"5","12","3","Environmental thing exactly player air resource.","04:41:52"
"8","18","1","Unit ready you whose not identify plant everyone.","07:10:35"
"18","35","2","Hold relate last sure term fish charge likely fill.","17:48:08"
"40","12","4","Reflect way party out toward sign to low represent series six.","00:04:33"
"18","4","2","Foreign change doctor plan clearly reflect.","00:51:29"
"40","31","5","Picture yes left member hour amount energy scientist itself community.","09:09:32"
"26","0","3","Fear apply fish fact fill again.","17:43:18"
"31","35","5","Condition thank event property shoulder act poor whom and south skill on federal.","07:30:22"
"1","10","3","Force base involve white yard tax.","09:15:28"
"43","23","5","Someone current various find will great realize ask age.","08:00:03"
"1","11","4","Again knowledge thing offer hospital morning.","16:52:31"
"18","13","1","Southern wife common building not pretty body recent seven lay campaign.","00:43:34"
"18","7","4","Help official home rate heavy yes left manage cut material western.","22:23:16"
"32","17","4","Especially so reality without debate writer through agency she key friend into ask.","13:36:12"
"5","12","5","Stop military attack recognize certainly bag do past democratic.","12:18:50"
"25","46","3","However no compare receive this fire yet avoid town.","17:52:52"
"8","45","5","Fill forward glass meeting north look wife town bit production own TV.","17:59:41"
"25","17","4","Price enough reflect sure teacher identify again at step chance push.","20:03:35"
"40","17","5","Carry group site leg book television area.","12:17:30"
"1","27","1","Language fall statement save action clear with argue soon majority accept note foot.","07:56:35"
"26","43","4","Past close thing film opportunity billion head well.","09:54:23"
"1","29","5","Series radio population officer soldier model rock.","14:37:36"
"5","18","1","Fall test different later from various factor push south notice next human new.","04:05:15"
"25","1","2","Weight tend size between sometimes wall blue take simply reach him leave someone.","13:24:14"
"40","39","1","Brother page service opportunity bring serve fall determine father second expert start.","04:39:21"
"25","6","2","College run institution treatment just direction.","23:55:50"
"8","17","3","Set television century offer finally century society front particular product.","09:00:39"
"40","47","1","Base far manage force threat only investment note she bit.","22:31:11"
"26","15","3","Successful everybody sign weight after spend join measure represent.","12:42:47"
"32","31","4","Everything summer like result kid challenge forget clear.","11:18:16"
"8","49","5","Heart through very either sense them major language.","23:46:18"
"31","15","5","Try box wear easy popular medical list apply still.","04:06:39"
"1","28","1","Face consider under knowledge my admit financial accept oil.","12:01:23"
"1","1","5","Religious challenge dark specific cell card argue message debate morning believe executive near.","16:04:38"
"1","30","4","Describe Democrat guy fact American radio ever run measure force work cause.","13:14:23"
"8","18","1","Child personal too story meeting its from affect.","05:09:49"
"40","3","1","Play as seek sign forget live TV certainly seem.","15:23:33"
"18","17","2","Go step would direction worker me continue mean.","07:08:55"
"18","30","2","Material by fine you medical yourself seven.","01:55:33"
"18","18","5","Government president two keep teacher treatment wonder employee agency sing.","11:16:11"
"40","5","1","Kid determine poor sit leader sense politics follow peace stop stock arrive she.","03:23:15"
"25","42","3","Much force at admit finish someone dark market.","01:18:58"
"31","34","5","Cell possible either discussion quickly last your ball eat seem realize.","20:19:38"
"25","8","4","Western all trouble voice stuff local knowledge course treat.","18:54:31"
"8","24","5","Experience dinner teacher model position party.","13:39:03"
"40","25","2","Sign station PM international alone recent see four side society entire travel type.","23:09:37"
"5","36","2","Walk them coach form teach through be society remember.","17:59:36"
"26","47","2","Most president not list rock bring story wrong son open.","20:19:07"
"43","21","5","Check keep alone agreement great career section exist section baby.","20:04:25"
"32","17","5","Late task speak lead detail operation cost discuss any attorney follow stay cut.","17:00:54"
"8","19","3","Official which list religious technology make want health indeed site.","06:52:20"
"1","7","4","Bill husband your would behind young under.","12:11:24"
"32","47","5","Realize popular president yard whole knowledge few space machine late newspaper resource network.","05:59:25"
"31","16","3","Sort century able sister woman contain decision under blood.","10:09:10"
"8","40","2","Pull arrive job source yet produce election myself green long policy gun laugh.","21:40:55"
"18","48","4","Day stay tell specific worry increase enjoy case visit research less.","16:53:19"
"31","42","1","Life hot music spring reveal door myself personal best entire business.","18:07:41"
"26","33","3","Public west admit full indeed trade single analysis improve those carry safe everyone.","17:02:22"
"31","31","1","Long case current describe might PM also into effect suffer own help.","09:44:49"
"18","7","4","Continue ask democratic maintain peace under.","00:01:28"
"43","26","2","Part piece most painting can lose.","11:08:01"
"31","4","2","Case could field say wife public international.","21:49:00"
"43","7","3","Majority several pressure town PM at authority.","12:08:13"
"5","27","4","Scene successful senior sing find draw picture away system back hit they.","19:49:13"
"25","39","3","Him attention challenge staff Congress again wall gas tend run.","22:19:06"
"43","28","2","Investment interesting skin coach hand high.","23:57:58"
"5","20","1","East recently movement include similar drive.","23:40:16"
"40","35","2","Reason son car model answer billion stand democratic thought enjoy less current.","06:16:44"
"5","39","1","Article suggest attention thus cell trade painting up.","18:27:54"
"32","5","2","Whose man leader offer onto small chance.","12:07:39"
"43","48","5","Mrs without hour ok a marriage.","07:50:36"
"25","41","5","Space good pressure soldier short inside long compare agent choose foot actually should.","16:34:35"
"31","13","1","New five choice line we ability dark.","07:17:15"
"18","34","2","Economy morning reduce now eat worker room.","06:14:48"
"43","11","5","Organization toward cut value management although TV eat of your boy change.","18:35:45"
"18","40","4","Much easy travel blood participant series world.","22:46:41"
"25","30","5","Reduce on police mission environment data.","02:26:37"
"40","44","5","Pm play kind color room arrive.","06:42:50"
"32","7","3","Drug water mean whom everything structure.","09:44:29"
"18","45","3","Bank especially staff indicate help success.","18:29:01"
"1","12","3","Prove weight decide security subject bar enough former.","22:32:07"
"32","19","4","Forward wall common candidate compare piece affect risk society down trial all dream.","06:40:40"
"40","0","4","Force cup offer rock soldier fact various where budget buy.","18:23:10"
"8","27","1","Seven door part maybe like language.","02:59:23"
"8","38","3","Congress wonder federal quite prepare usually offer place performance wrong beat.","08:26:28"
"25","4","2","Their already really mother participant worker argue fly.","07:10:20"
"31","17","1","Join I something his prepare south successful can send computer conference adult.","09:35:30"
"31","6","5","Forget choose support perform least let these training have before whole local sit.","22:59:35"
"32","32","3","War begin same teach wish three population yourself baby statement garden suffer fine.","13:19:29"
"1","0","2","Modern keep wind idea decide student create case center nation worry pass senior.","19:00:10"
"31","1","2","Big avoid yourself for college member born billion book.","05:16:30"
"5","21","2","Kind series sing environment stand trouble guy positive.","23:29:00"
"40","20","2","Common never eye know model hotel color public before huge enough.","01:02:37"
"8","36","1","Stuff worker course apply actually require try trial cut strategy sound concern instead.","10:49:44"
"26","20","4","Impact kid fish try us week.","19:47:46"
"5","21","2","Administration forget our reflect role during hospital.","17:05:57"
"5","6","4","Environment standard bit administration movie meet.","17:44:12"
"32","31","5","Risk similar keep young conference including prove similar say economy coach.","23:49:20"
"18","26","4","Large value right Congress gas fine practice return tough sit try.","15:51:00"
"8","37","2","Evidence blue stuff but type cause various pretty people.","11:10:33"
"1","49","4","President medical occur special night site enough himself career why.","14:16:16"
"8","25","3","Perform impact decade official get one want officer born street couple.","23:34:12"
"5","3","4","Know my collection direction remain movie whom three dinner act rock.","23:06:29"
"25","36","3","Yeah top act everyone region still bag.","08:31:09"
"31","2","2","Appear someone best local together fund.","18:53:45"
"43","9","5","Far middle skill government computer race candidate.","11:09:32"
"18","29","5","Across maybe election receive hit happen store.","18:42:26"
"18","20","1","More ever result finish agree southern service point wait.","22:30:32"
"43","3","1","Member life pattern special baby enough budget win enjoy civil top.","15:03:39"
"26","6","1","Each above truth fly score behind prevent will.","15:36:30"
"32","21","5","Almost eye possible away son reveal when.","07:18:16"
"32","23","3","Control meet direction improve look describe.","00:52:59"
"40","28","4","Risk work out maintain style bank such draw sell.","15:30:58"
"1","29","5","Recently hospital control difference your almost benefit side director two money concern hair.","21:31:51"
"26","33","1","Former bag science election respond policy always choose range less so Democrat.","07:44:09"
"1","46","5","Movie knowledge character we region story pattern effort boy commercial.","20:13:52"
"25","38","2","Important network guess wish thousand fine.","17:43:22"
"40","7","3","She nearly condition edge strategy finish your unit.","10:48:24"
"1","17","2","Decade accept company mission he financial.","08:39:40"
"32","13","1","Rest each remain thus group author draw quickly ready value.","22:44:09"
"43","23","1","Necessary PM bring say smile yet either face someone strategy expert early less.","11:12:08"
"18","20","1","During somebody per adult nearly heart any suddenly soldier bring certain three.","09:39:26"
"18","48","4","Difficult purpose report six like off employee thought stage behavior doctor along resource.","06:48:10"
"18","47","2","Speak impact now maybe explain eight pretty break.","15:09:30"
"8","36","5","Else business right wonder fight least account their tell.","11:37:31"
"32","11","1","Able never executive success option mind visit to already adult writer participant along.","03:02:53"
"8","1","4","Change professor success performance us its wait page.","15:55:04"
"5","48","1","Reveal believe camera together well thus to than pattern high officer church.","23:16:07"
"32","6","5","Reveal special letter professor respond ready recently perhaps however.","20:45:18"
"31","37","1","Agency control produce often no drop take affect.","05:41:07"
"31","31","2","Will ball system until build generation pretty.","15:07:25"
"18","47","1","Defense south candidate actually college thus special oil mouth say future level.","18:16:46"
"32","45","2","Position ground all charge budget there a.","09:15:28"
"40","18","3","Especially rate best table game total past walk staff structure each very energy.","04:52:01"
"1","49","4","Rest she account protect often successful.","02:55:41"
"26","38","1","Citizen today blue tax those from professor war sit.","11:08:27"
"26","8","5","College people modern travel listen thing senior know feeling remain war.","04:01:30"
"1","16","1","Experience blood clear check notice shoulder.","19:57:56"
"25","20","5","End clearly and election to record sea material instead recognize fact.","05:46:05"
"43","15","1","Oil sign identify buy member pressure maybe.","21:12:07"
"25","34","1","Admit story show indicate thank last civil certain nature myself.","01:16:05"
"32","37","1","Never spend new decide also service technology wind ground night action station.","03:03:26"
"5","11","5","Color focus only parent head brother nor pass treatment.","17:43:19"
"26","46","2","Themselves charge budget thought practice treat religious out kind them myself treatment.","22:02:13"
"25","42","3","Everyone ago young community huge matter.","22:48:13"
"8","9","3","Hour animal organization partner send for.","16:28:08"
"18","23","4","Affect never energy fill believe serious allow attorney sound.","08:10:57"
"26","30","5","Rather of out these relate evidence five threat traditional simply.","04:55:01"
"25","3","1","Might must site beat believe trouble actually.","00:04:21"
"25","45","4","Small in particular add become analysis seat director.","15:09:06"
"31","17","4","Against sound affect game toward thousand recent machine.","17:55:11"
"18","25","5","Executive plan morning senior across direction watch manager system should leg.","08:52:39"
"18","27","5","Soon finish billion senior test else boy.","04:35:24"
"1","11","5","Pull wait western that hard future eat wonder camera personal leg although.","00:14:22"
"26","1","3","Out soon home collection energy necessary within teach minute goal authority feeling.","16:11:56"
"32","21","2","Must activity resource adult appear attorney large.","06:01:55"
"26","22","4","Which sure cell nature maybe read much.","16:58:18"
"26","24","1","Mouth option across reach face data physical.","05:26:44"
"18","18","2","Size evidence state likely west wind over.","16:59:35"
"5","21","2","Expert base become finally sit simply.","08:37:29"
"43","8","4","Clearly behavior education particular road letter early member ok.","20:42:09"
"8","18","2","Get stop dream anyone remain central thing.","12:39:01"
"43","30","4","Meeting structure still course option involve.","19:06:50"
"43","5","4","Option reflect scientist shake top painting policy exactly.","02:21:33"
"40","49","3","Anyone field something voice practice mean some allow player.","14:28:27"
"8","33","2","Each region side evening interesting travel sort especially law there value all different.","20:22:55"
"26","23","1","Push food bank seek back adult.","19:37:02"
"5","39","3","Then quickly phone in actually available sign heart and stand senior official establish.","03:47:09"
"43","24","1","Interest name modern interview dark themselves ask.","18:34:27"
