"8","2","5","Simple in parent somebody list push program stage position here.","03:33:14"
"25","13","3","Realize over class relate ever often visit condition.","02:50:07"
"25","49","2","Western girl do right question interest debate even store plan where.","14:24:03"
"5","25","1","Month whatever song coach cultural approach service kind system its gas.","20:26:47"
"25","22","3","Vote report remain three much tend lead authority short drop marriage.","22:51:27"
"32","21","2","Continue seven source see charge capital.","21:07:14"
"26","12","5","Manage design white kid sometimes leave score shake remember certainly physical.","15:19:10"
"32","23","2","Open owner son writer particular person.","15:51:52"
"1","36","2","Her administration light party close clear nothing own pattern pretty cost simply standard.","02:04:18"
"43","28","3","Idea rock risk concern last morning build expert.","11:31:45"
"26","18","4","Doctor must so sing type inside dinner hard.","03:02:43"
"32","33","5","Pressure head off around spend south.","18:36:35"
"43","22","1","Sing suddenly moment under hundred degree hold day young join.","21:27:45"
"18","31","4","Final me radio organization five onto fill thus idea.","03:07:11"
"40","13","3","International computer investment ok wall alone.","16:39:56"
"32","10","4","Reason necessary leg writer need then laugh budget song local experience technology claim.","10:36:45"
"32","28","3","Industry story inside section phone billion hard agent single station late institution.","22:23:58"
"32","42","4","Financial strong interview condition wait year receive return level environmental drug.","23:26:54"
"1","40","4","Program able employee wish eye than already.","00:42:49"
"25","37","5","Executive money dark can edge avoid unit her nature above especially anything.","13:42:12"
"32","41","3","Both season keep everything offer season senior right be price woman American nature.","11:57:29"
"32","31","5","Know knowledge truth stuff offer free successful someone economic receive stop identify.","04:39:42"
"43","49","3","Record end during improve debate water catch course without.","02:08:31"
"8","43","2","Learn its method training bill especially ground water so.","05:40:53"
"1","5","3","White upon loss pattern address somebody skin stage course return name list onto.","16:03:47"
"26","47","5","Wrong performance into series music season amount each write general.","07:52:38"
"43","39","5","When near traditional money table yard yeah street.","13:24:21"
"32","23","4","Black ability sing your stand out ability close later easy response year.","08:13:19"
"31","44","2","Audience expect church or focus explain firm cell history reality hour station.","09:40:25"
"26","7","4","Sure education read bag hot daughter kind data cultural business play actually.","14:38:02"
"32","21","3","Treat difficult agency bed cultural billion safe watch.","06:42:22"
"1","15","3","Want movement bit hard notice compare point child.","09:26:55"
"40","41","1","East chair instead well writer beat all provide work especially say.","04:51:57"
"5","10","4","Among board age various miss style.","16:26:11"
"26","5","1","Cover because physical usually share water these continue.","12:58:58"
"18","2","3","Whether address everything summer west minute community money social his animal business same.","07:18:18"
"18","17","3","You school politics two hand safe raise own age suggest with.","22:56:55"
"26","30","5","Chair mind paper so newspaper large of imagine change very.","00:52:53"
"32","19","3","Skill develop leave conference meet set between front.","21:12:46"
"43","36","4","Case visit tax claim accept and national into condition office whom professor.","08:54:05"
"1","9","1","Surface life option language prepare it less market themselves increase.","08:33:39"
"26","25","2","Tv church participant Republican effort become year region.","03:27:12"
"31","18","2","Close center floor ahead other focus room religious back.","00:50:58"
"1","13","4","True be investment best section job final call.","23:20:22"
"32","41","5","Prove great run attorney off white outside human meet.","08:21:59"
"18","10","5","Allow happy get account serve town sing college.","08:11:18"
"32","33","5","Kid apply pass onto plan budget study commercial author per population.","00:31:59"
"1","13","1","Their some focus almost account smile issue assume keep.","12:51:54"
"25","45","1","Sort many head writer rate Republican decade political.","22:44:29"
"26","3","2","Model stuff follow series against agreement question.","08:10:26"
"26","4","3","Door hand truth guy make real and reach perform strong action seem.","04:59:05"
"43","44","5","Help turn include American coach interesting message.","14:41:28"
"31","18","5","Film computer building threat technology dog decide should help and single.","03:20:09"
"8","28","1","Local my should use only yard cut figure rock suggest past impact class.","09:17:05"
"25","34","3","Process type she sing whether couple begin common nature employee strategy.","07:45:39"
"32","12","1","Individual attorney usually land prepare bank remain upon executive floor over.","01:10:17"
"26","11","4","Avoid then son result summer nearly scientist far religious my.","01:59:48"
"26","35","5","Blood nearly business true play without travel once cold citizen pretty see.","05:05:50"
"1","46","4","Five certain office board consumer air Republican show by.","03:46:17"
"1","11","1","Doctor likely miss population radio north.","11:31:07"
"18","16","1","Different long set everyone dinner way even report myself.","12:48:03"
"43","20","3","Do religious team culture no best college stage new official kitchen along.","00:52:51"
"26","46","2","Discussion remember across garden bag turn wonder science standard simply common.","11:55:36"
"32","1","5","Ability window ground listen lead however eat study father determine radio clearly.","05:01:10"
"1","35","4","Each worry could leave any reflect.","04:21:56"
"1","49","5","Discussion instead series very then safe write day religious pay experience station past.","08:54:07"
"8","30","1","Who top bit box nor interview benefit like day.","23:50:57"
"31","3","4","Structure subject wall line debate land front word.","01:54:39"
"18","9","2","Majority go quality star put region letter nor.","16:36:39"
"18","22","4","Person yet no American sport dark improve figure.","22:36:56"
"25","19","4","What able Democrat culture great when who enter its take want hot.","22:09:59"
"8","11","1","About office buy media protect wrong yard those.","05:02:52"
"25","25","3","East return my front keep body.","13:59:53"
"1","21","2","Share beyond movement structure modern himself describe realize relate data order catch exactly.","21:36:18"
"1","19","1","Decision cell join east finally later sister thus follow.","05:49:08"
"25","6","2","Training bring lay far will actually act there night agency.","14:04:36"
"8","15","4","Evening believe statement door policy beat data none area to national.","08:23:04"
"26","14","3","Story population must born figure throw middle.","06:59:25"
"1","9","2","Look oil remain range form same from see so war word reflect bit.","16:42:31"
"32","49","2","Off vote also cold those receive any give everybody street heavy.","02:44:34"
"26","19","4","Town evening particularly give he to experience top rather somebody PM machine.","17:21:24"
"31","43","2","National shake family newspaper land go understand.","03:37:09"
"26","32","5","Least list others apply near office occur reduce human soon build require.","15:40:53"
"26","44","5","Course base hour strong front program.","23:07:28"
"43","35","3","Six general full laugh which yes bring operation thing thousand you.","18:52:41"
"5","4","3","Recognize yourself Mr wish low kind political TV forward wife claim once.","11:54:36"
"1","49","2","Computer man back behavior traditional professional thank when.","18:42:29"
"26","23","3","Effect message face score financial identify people seem design rise leave choice type.","04:37:34"
"31","11","5","Read market never fear maybe purpose cost standard market mention technology public.","01:29:24"
"31","44","5","Suggest miss reduce stage wall trouble throw gas.","19:21:28"
"40","35","4","Modern well although outside third voice report.","03:38:45"
"32","17","5","Beyond close daughter technology outside information author raise away throw.","03:05:32"
"5","43","3","Fine meet media animal speak next risk new.","09:07:01"
"1","28","4","Author shake go physical fine answer similar beat campaign.","01:25:37"
"26","17","1","Sea deep federal identify general agree live unit news individual ability happy.","06:44:24"
"32","42","1","Tv actually they suddenly others pattern life culture trip source.","03:35:06"
"8","3","5","Such education feel remain election can daughter or lose wish.","12:18:21"
"18","46","3","Away nation southern expect debate pattern phone its.","01:21:28"
"5","14","1","Special sea box throw movement focus factor create represent song beyond.","19:39:45"
"18","46","4","Lot course present experience ask management recently.","09:42:51"
"31","2","2","Hair during later herself experience wife certain enjoy people.","15:18:41"
"25","13","3","Level fall special month step again.","22:52:50"
"31","4","5","Manager would leader group tend fund think that action.","09:57:52"
"18","39","1","Garden eight keep no recently seat role try develop not need.","10:51:06"
"25","41","3","Future light power another into civil thus produce building success.","10:53:39"
"26","32","1","Against wait yes kind half campaign style us teacher share partner.","09:04:35"
"32","10","3","Decade win trial should represent her practice notice new drug race.","13:56:39"
"18","20","1","Write official type social personal improve something huge establish.","05:39:15"
"25","31","2","Much ok while police share race return probably rest time yes guess perform worry.","01:11:25"
"5","44","2","Should popular federal article feel term nature be begin event something call.","10:08:39"
"18","39","3","Their our single case table house why poor management computer hand.","19:33:25"
"31","35","2","Fear talk than sea nice me sea history reflect attack.","09:49:23"
"43","29","5","Quickly law whose business later drive be commercial actually gas father nation.","03:28:44"
"32","7","4","Gun positive near general table past bed field measure.","18:20:39"
"32","21","1","Hit page sign along only within at decision especially well toward ground.","19:24:21"
"8","16","4","Floor share part cover truth will stand agree treatment method question worry.","02:47:25"
"43","11","4","Because majority character reduce be help.","18:54:47"
"43","23","1","Seven occur agreement story should tell top party.","22:32:25"
"5","26","5","Keep drop only responsibility trouble his loss teach middle unit.","21:50:22"
"43","36","5","Board method audience somebody long south new certainly though affect.","09:57:33"
"31","18","4","Election control its lead cut anyone outside issue baby science.","19:19:17"
"43","41","2","Involve pattern major line teacher pick manage analysis across inside meeting.","07:18:21"
"26","25","4","Risk modern glass individual policy just really thus own oil organization soldier general word.","09:42:37"
"25","41","1","Single tree half north upon successful.","17:23:40"
"40","0","3","Animal her its first evidence take.","02:28:22"
"18","46","3","Air issue foreign piece card glass here deal amount large sometimes for without.","01:23:32"
"32","5","4","Break run treatment myself first couple left.","21:19:55"
"31","19","5","Tree first far other entire story oil to.","11:06:16"
"5","14","2","Commercial need happy by book speak.","17:06:59"
"32","23","2","Smile let oil among especially build success.","06:22:06"
"31","33","5","Big top maintain mother operation lead can.","16:55:38"
"8","24","3","Administration enter single really across measure nor approach.","01:25:19"
"32","11","3","Feel knowledge of age vote suggest.","20:08:05"
"26","22","1","Occur whose prove friend artist produce still former of project possible.","07:47:48"
"31","29","5","Side item chance of ten walk parent member.","12:54:52"
"8","40","1","Poor practice concern performance write pattern almost some your very raise husband.","03:28:44"
"25","38","3","American five democratic grow a vote future method language fear make hard.","22:01:41"
"26","26","2","Town music friend city hard sell guess before now no.","15:39:44"
"26","7","4","Box change everything property and save feeling.","22:03:39"
"5","35","5","Picture through account teach game production.","12:29:26"
"18","22","4","Away ground her bring country appear network never light.","03:03:02"
"8","24","1","Bill artist way seem performance bag pretty week the special plan.","18:26:18"
"25","37","2","Crime process suddenly party central maybe past pick material.","04:35:45"
"43","45","4","View machine physical site at financial.","12:51:43"
"43","8","2","Hour under sure standard describe interview.","17:47:42"
"32","14","1","Strong one some evening partner writer meet.","09:53:21"
"40","30","1","Shake wish consider accept include story loss create person.","10:20:58"
"8","28","2","Usually game price rate drive sort risk both bar mind.","04:07:46"
"32","43","3","Couple student different open spend subject best should federal movie individual.","16:56:42"
"1","16","2","Pick sign them seat career miss difference lot eye way structure never laugh.","15:44:52"
"40","34","3","Opportunity involve one situation nor bill situation each herself man drop heart material.","13:36:36"
"8","41","4","Last stock mention behavior soon maybe purpose.","03:32:21"
"18","48","5","Financial student institution among modern material field accept media.","13:11:31"
"8","16","4","South edge quite company sister could build parent unit future some institution.","01:26:35"
"26","18","1","Sound young read total hard those strong rich activity.","05:16:16"
"32","23","1","Report light old affect money law benefit world pick.","22:46:43"
"31","1","4","End view better artist seven control.","07:31:38"
"26","25","3","Difficult good Democrat effort chair wide doctor need building never those notice.","14:38:03"
"5","40","2","Experience position center indeed movie from her condition.","04:27:00"
"1","39","5","Itself leader manager feel spend hot from road pay minute artist government single.","15:12:36"
"43","1","3","Tree run offer pattern it theory bit.","01:29:15"
"25","41","5","Former live little onto hear figure information small to property.","10:00:35"
"1","22","4","Kid low Democrat behavior miss than late huge expert practice car must either.","10:12:49"
"5","34","5","Few station fill media citizen poor carry network poor garden take analysis.","02:08:33"
"5","29","4","Live collection society they word respond how.","13:58:20"
"26","3","5","Crime create book rest wish our administration instead.","21:13:57"
"18","30","1","Do bar look remain stand course site food.","10:57:05"
"8","10","4","Land direction off direction these along see central far east help product close.","18:39:19"
"25","40","3","Really risk put idea part international management option bank way.","13:47:41"
"8","42","3","Create none parent future effect people ago down song arrive might exactly.","19:17:01"
"40","35","1","Technology national leg per response federal policy.","17:55:57"
"32","43","5","Under thousand first audience able tell let two chair take.","20:25:22"
"25","47","3","One avoid safe beat every think item believe.","18:11:28"
"5","29","5","Investment control treatment market necessary job pick road nearly last list either direction.","18:39:17"
"1","6","5","Onto control we behavior moment step benefit eat difficult.","02:22:21"
"40","39","2","Statement which behind general I establish put resource.","16:00:58"
"40","48","4","Adult rather message smile speak ready start.","14:39:54"
"5","30","5","Water miss as continue hair born student.","21:25:24"
"18","10","5","Cut paper inside particular television may collection lay camera with discussion.","03:43:13"
"31","33","5","Various what knowledge music our economy.","09:24:23"
"40","22","5","Week market protect since security bill walk.","09:44:00"
"5","15","3","Whether strategy listen economy month type voice region chair.","18:26:19"
"32","0","4","Establish study clearly safe stand part challenge.","21:16:01"
"1","47","1","Hour huge speech school program factor meet leave road push.","13:26:30"
"43","16","4","Involve center long lose father decision bring figure success difficult learn.","07:08:35"
"8","24","4","Music network animal method while institution than cut conference call hand work indeed.","10:00:23"
"18","41","4","Rise north identify key always finish matter peace form reveal factor.","10:40:01"
"25","44","3","Also at cost foreign account model world teacher.","08:57:11"
"5","6","1","For season common somebody tree amount cost include statement cover.","09:11:10"
"8","37","2","Charge go over study early behavior become.","02:43:16"
"31","48","5","Hundred church tonight deep for organization property forget each leg southern arrive concern.","13:13:50"
"43","28","2","Material arm them least score without own necessary occur arm school employee.","04:19:37"
"31","23","3","Claim until son whole west believe day head play century.","14:10:15"
"40","1","1","Actually certain pressure window best part appear either challenge option.","15:35:46"
"31","49","2","Relate Mr analysis whose series figure very response collection.","18:36:28"
"26","25","4","Always week risk people book respond catch finally cost.","15:54:15"
"43","28","4","Bad increase event bill number son.","20:29:04"
"8","32","2","View mind me practice another big think what man test.","14:39:18"
"25","41","4","Article large late close himself charge appear future center red develop skin.","19:50:18"
"32","11","2","Product physical board affect section hear feel director job protect here.","17:28:41"
"32","26","5","Bring performance race result should could box conference establish TV.","09:55:18"
"5","28","2","Need religious above agency kind bank good win ten article.","04:36:14"
"5","14","1","Region among hard far far wide.","01:46:01"
"1","20","4","Door across effect anyone finish sing.","22:44:01"
"18","27","2","Watch break send couple set surface add nice address management huge before hotel.","04:21:50"
"5","33","2","Family continue speak let box act majority seven response price develop take strategy.","13:34:46"
"25","30","4","Thing property rest lay picture bag husband city add involve.","08:22:32"
"25","23","4","Almost note stand particular present senior mother.","01:28:03"
"26","7","1","Husband join whether north state away employee around south direction go.","00:40:40"
"26","49","3","Fast election music military brother other walk likely above.","08:28:47"
"26","5","2","All involve opportunity hear bag bit interest recognize discover six north.","20:53:48"
"5","20","5","Offer most keep fly at research middle notice apply world control recognize.","06:20:00"
"32","49","4","Look dinner left event decide especially total the police.","14:20:02"
"40","16","1","Marriage prepare significant station stage bank.","21:54:29"
"18","31","3","Part toward movement represent future almost catch number commercial range herself thus home.","18:24:13"
"18","12","1","Task team however four heavy candidate hear position.","08:22:12"
"31","33","4","Establish church send year instead manage with.","00:44:30"
"32","31","1","Red main seven area vote training must face choice see.","01:10:07"
"8","28","1","Resource trouble citizen major these activity available environment.","20:13:27"
"25","39","3","So score front family American authority woman candidate current all writer husband.","12:43:53"
"43","26","3","No degree energy example case clear day head research property.","03:19:27"
"43","6","4","Account discussion capital hundred magazine structure pattern mission window state past smile suddenly.","12:09:00"
"32","18","2","Agency also much nice list cultural against bar local out word power health.","10:23:03"
"18","8","3","Wonder blood operation like affect open like.","21:07:29"
"8","36","3","Seat record trouble might executive improve feeling strong image away.","08:33:16"
"5","0","4","Fly smile budget cold rule know me question accept.","13:17:29"
"43","42","1","It option parent face one until rule actually body appear.","21:30:33"
"25","29","5","Interest purpose attack let thus tough partner discussion.","17:12:27"
"25","22","1","Drive simply compare somebody analysis camera allow we land happy.","11:53:25"
"32","29","2","Old week debate treat other perform police yourself treat issue minute meeting.","01:40:09"
"40","11","3","Foot strategy set throw different character Congress many evidence support check.","05:37:50"
"25","0","2","Miss offer big house let through cultural career grow article.","15:21:04"
"32","5","5","Agreement case discussion western side meet respond view it dog meeting effect.","03:41:05"
"26","20","2","Service he life tell among executive international increase focus yourself human bed.","18:45:50"
"26","2","1","Do which coach forward bill administration range always all set room paper.","23:42:38"
"18","7","1","Respond forward item lawyer almost develop life.","15:55:11"
"40","44","5","Attack bed road conference opportunity however conference cup high usually per play throw.","05:59:31"
"43","43","1","Appear true practice yes positive decision enter however many mind what suffer.","05:28:06"
"43","23","2","Know federal memory same picture fear young attack politics often hit of over.","08:37:37"
"5","29","4","Work while perform term sea lead model religious north director PM many.","01:45:39"
"31","34","4","Pm agree house word force nice hot letter teacher conference she environment.","10:51:00"
"26","2","2","Democrat cultural bring bar shoulder tonight number human.","06:59:36"
"32","2","1","Game east charge husband across agent statement speech address.","07:12:13"
"26","6","5","Story between wide gun suddenly into explain.","20:09:27"
"32","47","3","Himself store response traditional tell try from huge.","18:09:46"
"43","23","5","Ball main crime meet suddenly truth several able create its without bring.","15:48:20"
"25","24","4","Community several lead player college raise voice control still wait save.","04:46:13"
"26","41","1","Most success always race become result.","07:17:06"
"43","31","4","Call general already expect well himself.","13:07:37"
"18","11","3","Can produce else operation court friend say focus.","20:14:22"
"40","41","3","Series simply benefit nearly memory worry out.","09:13:57"
"32","30","2","Piece give attention little difference professor best believe son.","06:26:42"
"8","32","1","Free ago way decision score person will.","01:27:07"
"25","21","5","Toward officer you nearly generation car painting during.","06:49:34"
"40","26","5","Short challenge whatever summer worker remember since look fine situation sense option though government.","12:33:15"
"26","49","3","Specific discuss tax author cultural game he serve know poor spend.","10:20:06"
"32","41","3","Create everyone own once street help home able approach news.","17:18:46"
"18","5","4","Win up Mr knowledge speech item maybe east thing.","03:25:40"
"43","13","2","Mouth drug simply economic possible bill wait high kind author large.","07:11:27"
"18","41","2","Scientist yes choice big news grow send interview.","05:42:26"
"32","8","5","However machine indicate campaign open hit decision easy particularly include figure spend interesting.","18:36:42"
"25","27","1","Close finish tonight yes likely four.","09:35:20"
"25","22","1","Take what together commercial member buy financial sit hundred subject rock lead much.","05:39:32"
"26","15","2","Art they buy send pull event care recently order example.","03:32:53"
"8","11","2","Natural man most mind walk but keep Mrs.","00:29:13"
"31","48","1","Even office everybody wear executive over argue.","23:03:25"
"1","22","3","Site quite voice order focus three team audience control finally certainly skill debate.","20:22:52"
"25","48","3","Fine natural thank would level determine my choose set clear.","08:01:33"
"31","47","2","Debate property report authority vote above change.","17:35:09"
"8","49","3","Game him same how defense Republican green.","16:56:08"
"25","39","4","Establish test finally Democrat college that add next debate thing stop per.","01:53:22"
"5","24","5","Chance modern debate piece within save matter sell campaign clear special.","05:47:41"
"40","33","4","Because both and material join similar inside.","05:28:00"
"25","4","1","View worry easy quite statement painting time during.","07:38:27"
"8","9","3","Pass feeling bar watch large television determine your.","10:41:29"
"8","0","3","Loss old throughout anything fine do.","15:45:29"
"1","37","3","Lead dinner box live factor home.","14:49:12"
"8","43","4","Add candidate program for idea happy political claim budget feel son.","22:04:11"
"31","8","1","Population thousand put lay option remember necessary respond manage action ever.","16:04:25"
"8","39","2","Wall enter activity behavior accept vote involve work material break raise.","08:32:28"
"25","18","2","Control street bad work strategy subject.","06:06:14"
"5","17","4","Candidate present organization civil avoid sit each far argue list power represent.","16:05:47"
"32","23","4","Reality threat special best forward nor once whom perform.","04:53:29"
"8","24","2","Him arrive clearly part cup product.","06:51:30"
"18","29","2","Tonight network goal executive current reach production field argue nearly voice.","13:13:49"
"18","0","3","Democrat bill send success financial minute key movie.","23:04:10"
"18","26","4","Significant soldier theory notice physical middle relate whether pretty poor near.","02:39:47"
"5","42","1","Mouth different rock war form college seven win.","15:32:44"
