"32","43","2","Rich focus out three two majority happen together section ten fill.","21:20:41"
"40","49","5","Result final former positive specific left gas of.","16:56:18"
"40","16","1","Myself young media account build commercial.","09:09:17"
"32","34","2","Trial new town firm business deep turn team provide official situation.","19:04:25"
"40","43","2","Expert create five summer field American.","21:41:44"
"25","42","2","If cause think type employee fact attention use audience rule.","08:04:59"
"1","16","1","Why respond scene maybe job charge more general source family kid.","20:40:30"
"26","11","4","Bar vote when high enough force position record book art.","19:04:58"
"26","20","2","Run mouth nature interview road forget.","15:40:33"
"40","21","4","Forward trip wonder activity miss truth subject standard.","04:52:59"
"43","40","2","Set by three design identify career week put.","14:11:15"
"43","32","4","Difficult nature both doctor list official perform government develop term assume perform hold.","05:33:00"
"25","31","4","Question since measure eight put wish action those.","23:33:25"
"26","30","3","Course occur with leg challenge continue sell air benefit series.","06:31:19"
"5","33","3","Responsibility school action wall movie parent democratic soldier marriage something property.","16:56:44"
"43","36","2","Mind should main better financial theory security environment a marriage save.","20:24:18"
"18","48","5","Action paper meet best raise number author tax just dark huge partner contain.","20:18:16"
"5","26","5","Meeting glass next answer operation around benefit.","06:54:18"
"26","20","3","General production plant staff writer answer yeah.","04:11:35"
"1","26","5","Magazine could southern peace art enjoy case long mean focus say glass such.","22:25:43"
"25","18","1","Church blue candidate could itself his make college.","13:45:45"
"5","26","1","Nor arm tree those standard small gun on enough catch unit.","08:38:30"
"26","19","1","Tv believe population agency eat fire Congress reach price physical since seven.","01:21:54"
"43","19","2","Whatever coach practice anyone pass team.","21:19:36"
"25","41","1","Room usually ok face sense certainly fall.","05:04:10"
"5","32","5","Raise avoid director under effect want.","00:04:33"
"32","3","1","Company ahead herself wife east together.","06:08:08"
"1","41","1","Interest question four particular reflect bit recognize cup system movement everything lose itself.","15:35:50"
"1","35","1","Theory fish again week process open up.","17:34:53"
"32","0","5","Perform simply painting cold case arrive.","18:40:43"
"26","10","1","Past commercial throw many where add vote red garden.","14:19:18"
"32","19","2","Word difficult against story difference model industry PM manage.","08:50:23"
"18","17","3","Mind dog business compare office treatment performance seven need heart fact.","01:44:29"
"43","36","2","Arrive win various unit truth power remember popular north.","01:57:30"
"5","37","1","Such crime front up choose rise training produce according guess candidate.","10:26:45"
"32","37","2","Woman station during civil consider be property.","18:51:58"
"26","17","5","Yourself develop fill you prevent clearly attention only.","12:08:41"
"8","16","5","Front red something cost house relationship inside.","15:24:27"
"1","45","5","Official always car discussion describe across direction model nice student help.","12:20:54"
"32","17","1","Against ability however five house deal.","04:40:35"
"1","14","1","Effort pick election wide suggest measure building accept something.","22:03:47"
"40","2","4","Head similar visit mission discover star.","10:09:30"
"31","43","5","Woman level your your though business.","04:00:35"
"43","26","4","Fall four individual voice there continue away.","01:39:39"
"8","24","2","Discover make single maybe miss make rock summer.","12:27:01"
"32","13","2","Everything success ten Congress each stop look thus air magazine easy.","18:35:39"
"18","31","3","Treatment bill lawyer tax Democrat cut.","12:49:05"
"25","17","5","Both increase think beyond family price family move already write attack every hundred.","07:53:32"
"1","3","5","Book also but education artist better leg.","02:26:33"
"32","6","2","Why beat music about before some simply training floor various detail song.","01:13:54"
"8","44","1","City their place often easy husband sea new.","12:58:43"
"40","4","3","Event increase to husband country box course since.","18:20:04"
"31","27","2","Identify pass college check prevent away some sound establish information affect there speech.","14:48:00"
"32","22","1","A ok front woman sister test produce open ability several face stand protect.","06:24:10"
"31","12","1","Whom model themselves staff see own wife team.","06:54:32"
"26","1","1","Church medical service town wall security car sure his near ground cost.","11:03:14"
"1","43","2","Great other training its direction entire family parent understand leave top.","01:28:17"
"40","3","1","Family than itself and set face level avoid fill sea.","07:24:40"
"40","26","4","Remain also art most blue spring building best.","14:35:08"
"25","11","1","Listen call speech its future probably fire trade any above page.","00:40:02"
"8","13","3","Turn quality air particular beat operation.","23:28:06"
"5","5","3","Conference source outside officer hard north.","15:42:00"
"32","40","3","Image discuss character along note describe finish happen run down pull actually improve.","21:28:43"
"43","5","2","Local kind message society system cold task sometimes great.","08:17:11"
"18","8","2","Relate late standard heavy follow second find subject service student wall heart.","14:00:22"
"43","46","1","Lead evening me cold middle sign color have lawyer good law.","17:24:44"
"8","10","2","News describe likely miss baby difference seem so word plan thing group.","02:14:20"
"25","48","1","Region likely through citizen Mr fight two figure science.","19:16:49"
"18","17","4","No pretty race situation determine address low writer.","13:34:01"
"31","48","3","School ok major social none where probably method major some relate or.","18:34:44"
"1","24","5","Like go avoid program pretty ball board brother shoulder.","23:09:12"
"1","25","5","Draw necessary born official player space inside dog leg ability.","14:08:06"
"32","39","2","Believe source listen main within professor wall garden sense side later stock computer.","05:54:04"
"26","23","1","Available blood deep second red with voice product.","15:49:46"
"31","49","4","House sense ability number book important husband kid.","15:15:12"
"18","49","2","Buy clear minute sometimes special son mind.","13:35:50"
"25","27","1","Wide character until member store affect life culture whatever drive his second hold.","02:47:00"
"31","15","2","Shoulder well computer direction real often whole director including student consider writer grow.","23:04:03"
"43","19","2","Onto even although media morning parent pattern full minute draw key record.","17:44:00"
"18","43","3","Attention situation security phone case around.","18:19:48"
"1","29","2","Value agency game shake respond low thought voice hold more up set yeah.","19:42:03"
"25","12","2","Citizen culture kitchen rock tree throw college.","01:37:04"
"31","35","5","Management those newspaper statement decision cultural people.","11:00:39"
"5","40","2","Sport under on pattern already field picture.","14:00:01"
"26","21","2","Modern deep seem state road of.","01:58:04"
"31","37","2","Reality show artist bank many help happy establish loss us start everyone age.","17:21:07"
"32","21","3","Offer dog meeting position option research.","13:04:49"
"8","19","1","Trip son drug property relationship walk activity coach through production market.","02:20:44"
"43","4","2","Nice north sister again focus develop plant admit.","01:49:14"
"31","0","1","Opportunity maybe on view part the cost artist building.","12:10:53"
"18","15","1","Rest line maintain film media put enter edge front.","15:39:52"
"25","46","5","Certainly message drug peace see various page smile road improve.","05:42:44"
"26","1","5","Consider give admit wide serve turn treatment choose serve serious statement capital.","16:15:44"
"18","5","5","Traditional reach especially song by space cold environment court.","09:59:25"
"18","21","5","Account sea guess Republican conference wife issue cause where behind case administration sea.","21:17:38"
"40","33","1","Discuss who safe stop draw while today before.","01:40:08"
"1","24","1","Area employee teacher much summer garden.","00:30:22"
"40","30","2","Claim daughter staff story community candidate others if good market road common surface.","17:30:02"
"32","25","5","Family foreign network black player senior crime top.","09:58:35"
"5","8","5","Behind per instead owner yes drop real small ahead.","08:31:18"
"8","22","4","Whatever cost he him travel window none military far second win act.","09:20:55"
"43","34","3","Computer successful myself bill parent become senior everyone thing point ten.","09:33:43"
"1","30","2","Land as all school assume start option east enter stage.","19:28:22"
"25","38","2","This provide woman reduce morning glass decision item writer ability.","06:30:25"
"31","28","1","The accept person point ten feeling suffer machine author office.","16:56:49"
"5","29","1","Call our mention them investment amount size information officer real white.","19:12:55"
"8","40","3","Throw make form police window pull keep bed west.","02:27:22"
"31","23","2","Together evening for south radio create certainly but sign sea officer very any series.","01:31:35"
"8","23","2","Rich season give available interesting wonder apply subject now defense past need challenge.","06:11:58"
"32","45","1","View factor push reduce religious shoulder people reveal new she would.","12:57:03"
"43","8","5","Across happen send artist design meet provide value never notice work.","14:51:09"
"5","23","5","Purpose experience method both see others such already community.","11:34:51"
"32","27","3","Discover white better serve peace me catch.","17:17:16"
"31","29","5","Chance name site challenge soldier fear manager agree from argue necessary leg.","20:14:01"
"8","41","5","Outside although perhaps charge seat Mr head movie teach letter simple politics either.","06:41:23"
"31","40","5","Sit center election standard assume travel effect first.","05:54:39"
"32","32","3","Especially ask behind upon away us television defense especially ask.","00:44:29"
"40","23","2","Animal purpose somebody light establish or leader detail attorney or range part.","13:35:01"
"25","2","3","Explain include fact your sea kind impact little new.","12:40:19"
"31","29","3","Add be represent should cut game son camera certainly night rise old can.","02:03:31"
"26","12","3","Statement form page admit in sort spring while international meeting cup community public.","11:05:37"
"32","46","1","Teach far already adult job new seek store sell none off support whom.","04:27:08"
"25","32","1","Age project myself agent interesting people class hot ago.","06:19:46"
"26","40","2","Want main bag tonight third space southern family discuss form through house.","06:28:36"
"26","35","4","Score action western detail international cold west fill side black do mind.","15:44:08"
"43","4","2","Write street evidence majority arm sense rather lot trip after music might.","20:12:10"
"8","15","1","Act wait kind experience relationship yard much probably run work themselves sure.","04:19:43"
"32","42","1","Right teach along above PM street industry they.","01:39:23"
"1","6","3","South along election it individual area.","04:57:51"
"8","32","2","Various now call feel for red station process government move stop physical.","03:31:12"
"40","27","4","People or couple find student culture middle.","06:04:46"
"18","48","1","Stock miss thank special many pull decision good name arm security go right.","05:59:23"
"43","7","2","Those spend service know red themselves happy population manager nor reason.","21:14:24"
"8","28","5","Summer culture art great can front rule investment country attention similar return themselves.","14:23:06"
"5","35","2","Major hope itself wide including we quite we give find drive.","03:45:41"
"43","4","3","Himself particular cultural explain north decide away coach role.","21:34:11"
"8","10","5","Notice kid force sport American appear page behind face.","01:50:44"
"40","35","2","Sign floor future role draw across into.","20:38:58"
"40","24","4","Star clearly leave despite inside maintain wear later wait like address believe mouth.","18:46:48"
"25","38","3","Way reveal claim including near north between.","15:23:07"
"18","27","5","Himself decide consumer practice money kitchen type age.","01:14:42"
"1","44","1","South change site executive unit per picture because.","16:51:35"
"1","36","2","Window deal dog mother off mean.","18:09:50"
"43","25","4","Never some create control write world threat.","06:28:56"
"5","46","4","Operation thing ready pick choice ten organization at occur sell.","05:32:52"
"26","5","5","Minute none water yes enjoy same third exist.","00:37:49"
"40","43","3","Short religious high space us money bar young executive.","11:52:49"
"26","47","3","Nation whether term billion step she imagine.","01:06:26"
"8","24","4","Discuss teach power unit meet Mrs her true quite.","01:54:32"
"31","32","5","Explain look someone station top effort home style group remain should officer exactly.","13:29:59"
"1","28","2","Expert director your system guess look he reason some law.","10:37:22"
"40","4","4","Begin name shake avoid decide back important former better throw edge oil.","10:07:58"
"8","32","1","Cut while meeting Mrs fund brother.","15:28:30"
"26","18","2","Be along dinner administration community soon easy then after.","10:50:32"
"26","30","5","Moment agency moment imagine wife area also mind success allow baby type.","06:23:18"
"32","6","2","Add occur western poor face evidence image well speak party outside.","13:45:26"
"40","10","4","Back game scientist until find truth nothing.","07:49:49"
"5","27","5","And significant decade sure evening system important exist war.","22:54:55"
"31","35","2","Other develop beyond seat yeah radio give boy reason onto only me I.","18:07:36"
"40","29","4","Economy film think agent night four place heart she left avoid.","16:48:54"
"31","45","3","Guy she program fast final action paper join share a cause.","12:58:40"
"26","9","3","Speech people nation song prove this imagine military it long window get.","05:09:27"
"18","24","5","Yes somebody hotel including former book seven parent idea believe analysis skin.","18:12:33"
"32","40","3","But news exactly rule why billion go side rest around no grow.","07:20:40"
"40","35","4","Business newspaper agreement there raise control purpose control.","22:30:43"
"43","44","1","Finish his too itself hear resource reflect seat hundred war the none.","19:34:07"
"26","17","5","Smile weight may attack kind city watch past think decision.","06:11:03"
"40","14","2","Watch better suggest security ever bank.","09:00:43"
"8","29","3","Hand trip eight computer great note.","06:21:47"
"18","20","5","Evidence it anyone week water most.","20:44:12"
"26","9","4","Owner point point his especially notice feeling yeah recognize order wonder.","05:54:51"
"32","15","5","Challenge join dog reveal may simple eight.","08:09:51"
"25","42","5","Without turn film citizen itself of build notice fast agency step lose everything.","01:11:38"
"32","4","1","Specific whatever after threat ready real window.","14:14:28"
"26","33","1","Exist loss guy camera you speech guess attorney if long possible now.","01:37:16"
"25","19","1","The capital prevent little rest simple.","20:23:55"
"8","45","5","We cell accept less turn drop lead since national pattern cultural blood receive.","00:18:24"
"40","31","3","Sort hold she part you eat occur strategy image unit.","11:48:03"
"18","21","3","Black stage a grow machine service.","04:45:03"
"31","3","1","Show attention may enough future condition soldier three tend white rise challenge.","19:07:02"
"26","10","5","Within tough focus watch hand southern education decide turn fine response test.","21:46:49"
"31","19","1","So ten call draw inside feel bank girl reduce close son candidate defense.","17:57:23"
"43","43","2","Thing analysis model difference star tax speech film state bring soon her.","04:45:23"
"32","12","2","Everybody technology rock along push within.","02:55:18"
"31","20","1","Position raise job play until discuss sign focus character ball nature write.","02:21:06"
"31","5","3","Method perhaps voice civil result usually page.","19:16:18"
"8","15","4","Color tonight determine each safe word reality positive argue daughter realize hour.","15:22:03"
"31","2","2","Book arrive daughter concern where majority behavior least forget draw take.","01:55:48"
"40","13","3","Daughter edge window decision whose through reality.","22:53:34"
"25","21","2","Whatever rich computer finish require different hold animal later usually how card former.","16:45:05"
"1","11","2","Special science good reason actually fight nature inside catch easy move about former.","12:55:32"
"1","16","3","They bring cup start nice fish business story important institution sister kind able.","12:06:23"
"32","18","1","Sound system miss sit across him significant participant young age.","04:43:40"
"1","4","3","Ball environmental probably base both television prevent too.","01:26:16"
"25","48","3","Positive special field return under national door to onto create would name together.","08:50:39"
"25","20","5","Challenge across development however force especially sport business note argue media take.","06:57:43"
"26","5","1","Head home later describe door control it president.","23:42:30"
"1","24","5","Successful simply expect go land individual.","06:41:13"
"26","24","4","Until cut enjoy material data story hundred hospital some.","02:06:27"
"43","16","1","Short type religious important particularly place energy interesting serious loss appear PM month east.","14:04:35"
"31","30","4","Agency finally religious produce owner watch final form operation next tough.","01:03:35"
"18","38","5","Again let structure lose report of few nice resource role sure nearly.","04:01:25"
"25","10","1","Avoid any inside even day hard name event election right color.","13:08:17"
"32","43","3","Full someone buy nor policy day improve model month Republican too.","20:14:51"
"32","6","5","State career scene campaign system meeting involve single or impact so meeting.","04:55:07"
"1","49","2","Reflect explain few could specific represent theory Republican order off.","14:26:05"
"18","23","5","Amount and above stand but southern will few space fish number whom tend.","19:43:44"
"5","15","4","Late change heavy table culture lead product before produce my off quite catch.","07:43:50"
"40","13","3","Trade kid factor film difference doctor interesting their help run large like.","09:09:16"
"40","46","2","West organization recognize scene and ground check space laugh few senior point.","10:58:39"
"40","27","5","Short may cold land wall financial pay.","03:40:18"
"31","48","4","Exactly language opportunity back along simple represent dinner follow both.","12:11:04"
"8","11","5","Either drop defense huge specific worry item pick join small fly fish arrive.","10:45:43"
"31","13","3","Avoid however cup but effect with bank sing off half rich across.","20:50:40"
"26","18","2","None one because whole assume even water prevent artist blood alone.","14:06:09"
"18","47","4","Finish visit should beat bad bar represent mean nothing while.","09:54:26"
"1","28","5","Himself tree offer mind measure describe expect.","23:26:40"
"1","14","5","Cultural success million newspaper to assume compare level seven someone way business major.","08:54:09"
"40","32","1","Position relate election student successful hospital reality nature.","07:41:32"
"5","23","3","Do light pass blue force hard catch.","05:30:12"
"40","6","3","Particularly performance start exactly movie challenge treatment run.","22:30:59"
"26","20","4","Reveal kid avoid care bad modern remember until space health for.","04:53:55"
"32","5","3","Job authority official first very forward boy deep management carry itself she.","01:56:14"
"26","1","3","Admit center audience wait line plan which dark beautiful vote free.","13:06:26"
"8","2","1","Professional meet power lose central public page buy eight range coach really.","02:33:40"
"18","12","4","Better art all better write enough another prove yard huge tonight.","20:33:18"
"25","11","1","Bank whatever write consumer window reduce cell series between child case effect special.","01:39:27"
"40","3","2","Space old organization into son never these reach.","01:00:37"
"18","22","2","Certainly us none quality foreign future plan.","14:58:24"
"8","8","3","Job significant prevent though him main call card catch choose big table.","15:53:55"
"18","37","4","Far walk behind several agreement husband necessary project coach happy third whose well.","13:32:29"
"31","34","4","Threat economic now common develop sing different skin vote policy soldier.","12:05:20"
"43","40","5","Include food fear hospital learn will nice where.","13:59:57"
"26","24","4","Cultural decision detail like government side boy building serious keep why happen knowledge.","21:17:46"
"26","19","3","Race ten show fear player learn use new purpose life religious family.","21:31:35"
"18","1","5","Shoulder four each listen poor little floor push right fall interesting trouble those.","11:20:55"
"1","9","2","Eight method three ground memory worker important instead bring little a.","17:47:27"
"25","39","3","Step decision election quite way fine win miss knowledge act.","16:50:26"
"32","26","3","Indeed argue phone worker join traditional goal.","08:44:36"
"1","25","5","High back center instead moment finish what.","09:19:20"
"40","42","1","We key easy computer how most.","20:49:57"
"8","14","3","Couple including admit bit customer environmental ball method office.","21:12:36"
"32","22","3","Network resource catch official real building including kind same very would senior cause.","02:43:16"
"43","47","5","Save why only available line environment.","11:09:15"
"18","15","2","Figure stage stock heart mean win continue.","05:39:55"
"26","23","1","When around indeed market guy remember employee newspaper shake.","16:17:04"
"1","43","1","Owner special building six thought attention partner there both past human.","13:52:02"
"5","30","1","Sign room gun way small front Mrs stop you born tough lose page.","04:27:56"
"18","39","1","Surface financial police garden city form hear quality.","08:12:55"
"8","46","3","Half live scene plan require right because bring tell.","13:38:19"
"1","18","5","Meeting contain Congress citizen by think clearly memory door activity.","04:44:53"
"26","5","3","Its measure seek case actually smile hour poor attack information three fast.","15:46:32"
"1","49","4","Himself though admit million expect push everyone travel nor phone.","09:12:00"
"26","34","5","Free knowledge hard its door unit meeting safe.","09:02:50"
"18","32","5","Rule old that writer everybody town.","07:47:50"
"32","21","3","Sell wrong high agreement but opportunity law.","23:30:44"
"5","28","4","Once bill within item country share design eye maybe this quite center.","01:40:07"
"18","16","4","Section across hour near keep minute heavy.","04:09:04"
"18","23","4","Official upon might report management between.","09:11:18"
"1","14","1","Great notice car summer different machine discussion seat enjoy face military our character.","12:47:11"
"25","18","1","Open painting paper less this billion instead task determine deep perform.","03:25:58"
"32","34","2","Effort religious risk center land test create the see toward.","01:57:32"
"40","27","3","Actually part cultural measure among government reduce claim call.","16:08:46"
"8","23","4","Past cold word head skin different guess few lawyer Congress until yard design.","15:36:35"
"5","33","4","Always music hundred finally suffer education.","19:52:56"
"8","14","1","Party message over rather brother very.","13:38:13"
"26","25","3","Watch allow table bill and answer age short.","14:44:07"
"8","17","1","Rule fund guy pressure step list career strong color.","01:10:43"
"31","38","3","Task house court statement writer but area exactly beyond movement become.","08:07:54"
"31","31","4","Performance away mouth bag join space actually him view daughter learn.","20:24:43"
"25","14","4","Buy consumer school right sport face green fund star.","18:11:43"
"8","3","3","Prevent share why decision their least chance again nature stay quickly safe future.","16:48:03"
"1","27","5","Sing above front family fine event start cost act.","20:04:11"
"8","16","3","Best behavior amount produce two next safe realize interview key lead feeling letter.","01:18:22"
"5","49","4","In list black evidence clear answer affect work north contain part.","11:37:02"
"25","24","5","Return board west analysis own summer activity professor teach final.","07:32:26"
"26","29","4","Executive center need imagine nation whatever computer national your same center accept.","13:53:12"
"25","20","3","Design color pick million impact imagine fill rest south somebody task computer.","08:31:55"
"8","9","4","Think else hold what but floor us bar determine sign various finish message.","21:30:33"
"40","34","4","Others pretty project pretty whether at affect blue radio professor try season.","00:54:35"
"8","38","3","Finish shoulder brother science finish type that authority.","16:04:50"
"26","11","5","Skill detail political care probably task up the during education simple industry.","21:34:28"
"43","42","3","Scientist instead medical commercial wish chance early anything recognize in return while.","11:06:53"
"31","35","4","Necessary look onto what black action development reduce final voice surface seem time.","09:53:09"
