"40","15","1","Huge business suddenly center dinner rather middle figure.","17:40:22"
"40","19","5","Since stand people score marriage forward financial it traditional.","04:27:54"
"18","26","3","Culture any generation president old continue institution.","19:43:11"
"32","46","5","Up she either gas form spend consider.","16:25:45"
"32","39","3","Line whatever generation indeed pretty require response heavy program.","02:34:41"
"43","32","1","Son indeed ball natural myself own laugh very.","21:39:04"
"8","44","5","Brother particularly price page improve message remain much these other shoulder town.","05:55:35"
"8","36","5","Body behind will prove spend notice close relate hit.","20:34:42"
"5","14","5","Low condition time glass future already hot hundred determine.","15:20:09"
"32","5","5","Water land consider a catch film state seek scene election face serve somebody.","08:11:38"
"25","2","3","Week officer particular he suffer big.","15:48:29"
"31","21","5","Off once recent wrong air realize ability hard.","09:27:38"
"32","34","1","Close source draw dog similar myself yes activity drop sea central.","10:38:59"
"43","49","1","Past sit begin someone partner focus compare majority key fall pattern Congress.","06:41:56"
"1","29","1","Suggest everyone there police should resource building realize model.","08:02:01"
"8","30","1","Work crime others year huge decision effort bit manage.","00:20:26"
"25","23","1","Form energy Mrs fund discussion different tree.","18:38:38"
"40","9","3","Why plant as that consider drop.","21:15:24"
"32","29","2","Civil college today whatever billion here.","01:52:15"
"26","2","4","Wonder growth but take four first fly before company so can mission question.","08:28:36"
"40","40","1","Mission purpose only late purpose each realize year.","00:58:26"
"40","46","2","Skill mind finally local present likely doctor.","05:32:36"
"25","12","4","Lose bar rule letter edge address real blue red doctor power bad should.","04:27:00"
"32","19","3","From join hot represent fine style ten message wife next stock hotel time.","07:56:04"
"1","17","4","Trade argue matter work story with identify personal great would score.","09:52:45"
"1","14","1","Point of evidence people than left reach word check control place goal.","12:34:52"
"26","41","3","Economy cell hotel else senior section leave time fight enjoy condition help kitchen.","14:22:58"
"26","43","2","Son director entire remain exist form our offer themselves without or or.","12:18:41"
"5","46","5","Fact left effect game meeting report account blue body.","06:21:34"
"40","37","2","Fine sing media computer prepare pattern south material other painting soon against rock.","03:53:50"
"31","9","4","Both crime be style pressure certain population bank law interview college allow response.","07:36:53"
"1","4","1","Total through sense modern say value few certain hour recognize raise.","18:32:18"
"5","42","4","Mean could particular southern cover claim.","00:47:01"
"1","39","5","Seat mention cultural carry anyone seven trip message side.","05:56:46"
"18","25","2","Tonight middle control card him site.","22:47:07"
"18","48","1","Play fall general ahead present yes summer let.","09:04:46"
"8","48","3","Point seat give use social work amount first action between suggest raise break.","04:32:08"
"1","20","4","Worker your individual set hit space.","08:57:37"
"5","40","5","Not country indicate every explain rock threat.","17:42:21"
"26","32","2","Source rule section whatever forward keep travel hour cultural assume.","12:46:54"
"26","19","5","Trial moment bed account myself country entire common culture money establish simple kitchen.","18:52:39"
"43","9","1","Week rather approach class time identify second prevent reality seat body.","14:37:21"
"31","31","5","Beautiful operation central history commercial rise sound conference.","11:42:33"
"8","16","4","Million happy most national itself near happen work window return executive letter entire.","17:15:43"
"40","7","3","Painting hundred heart area growth collection you myself.","03:26:21"
"8","29","4","Need individual picture difficult yard condition station happen.","13:45:45"
"31","45","5","Those writer choose magazine matter store school throughout and quickly describe.","21:23:47"
"1","31","4","American fight ten himself anything inside door reveal eight.","03:43:10"
"8","28","4","Either machine pretty someone green be spring article star continue happy.","03:22:50"
"40","18","3","Admit east wrong energy long tonight modern the back us.","21:44:18"
"8","9","1","Fine heavy crime lawyer hard everything dinner indicate should from glass machine control.","14:52:36"
"8","46","1","Let attorney interest street party stop this let range will find.","02:55:55"
"31","49","5","Address reason particular recognize hear production social consumer reduce above option anything work.","11:19:46"
"26","35","2","Prove simple picture would majority new enter wonder drop world foreign us.","16:29:15"
"26","44","4","Body oil TV although religious another across personal onto.","12:01:46"
"43","26","2","Worker modern safe leg newspaper create among fly wall.","13:44:17"
"8","25","3","Want this miss only visit attorney identify staff hospital understand agreement amount owner.","06:00:28"
"8","25","5","Listen discuss daughter point fund question.","04:49:09"
"1","20","3","Religious daughter table respond appear spend would avoid.","11:37:43"
"32","19","4","Specific down simple better especially reason already method.","20:37:13"
"26","23","1","Mention him realize upon common lawyer debate already.","03:54:31"
"5","25","4","Organization oil note result find others stand color opportunity.","19:12:19"
"8","13","3","Society remember ago prevent kid big against.","02:35:11"
"5","46","5","Avoid executive reality important decision owner.","01:02:41"
"40","6","5","List task newspaper ball station manager company traditional now.","22:10:28"
"18","38","1","Never beat prepare bring attack drug.","04:35:43"
"18","31","5","Long five how around property read investment prevent blue cell prove present.","20:48:53"
"26","30","2","Something anything new billion piece growth move ahead join.","13:16:43"
"18","10","4","Hair rather important exist glass speech institution including between study think.","00:02:33"
"18","33","4","Forward there anyone operation sit where let others.","07:48:34"
"26","45","1","Scene suffer federal personal support special high game computer.","18:41:03"
"31","10","2","Else thank create provide loss worry everything we dog learn.","23:45:36"
"40","9","2","Eye check seem single store try.","22:47:09"
"40","38","4","Lead particularly line tree pass attack real effort image eat test base.","13:20:19"
"1","19","4","Stage by way foreign organization thank modern billion public dinner positive focus.","15:06:40"
"26","28","4","Respond spring down respond unit loss lot entire glass not she window.","06:43:33"
"5","39","1","Treat sit voice next along ground crime.","03:11:52"
"26","27","5","Executive minute know practice analysis involve.","01:50:37"
"18","20","4","Letter mother everybody tough admit event run size team.","23:37:43"
"43","20","2","Subject truth expect they cut instead player interview game type student unit brother.","01:21:13"
"8","10","3","Reason party operation well question bring notice.","05:35:45"
"5","12","5","If bit power plant alone heavy instead win leader key network owner.","14:15:02"
"25","30","5","Husband treat people four full answer finish science protect dog goal above seem.","01:02:22"
"25","35","4","Win them push good job heart boy least since.","12:51:19"
"8","9","1","Run election age down woman as organization material institution direction yard son probably.","15:53:44"
"31","12","2","Lawyer not blue sort ago office human degree garden suggest.","17:54:59"
"1","21","4","Business society notice leg run late ability beautiful large price beyond several chance.","15:42:44"
"43","42","1","Rate high listen allow age community allow item director.","02:44:41"
"18","30","3","Report your baby vote where more trade again seat product ok medical.","21:35:25"
"40","27","1","Simple student goal wind assume place across than special success from travel.","21:45:32"
"18","8","4","Glass hold paper tonight age over area however almost resource key support.","14:00:34"
"26","3","4","Partner south third hope each several any.","06:32:23"
"26","29","5","Herself international Democrat buy risk born those describe describe woman message.","14:55:31"
"25","27","3","Type hour go others north everything help experience design husband work.","16:49:54"
"31","39","5","Bad increase enter simply when culture even civil amount.","14:22:22"
"26","33","2","Cause writer owner once ability force system movement financial later performance see.","23:51:42"
"26","10","5","Suffer response present owner five such much scientist race.","20:50:53"
"32","3","5","Create shake own consider organization although skin election dinner behavior.","00:51:16"
"32","13","4","Group mean personal matter reason medical full century almost floor indeed create.","07:05:54"
"8","25","1","Just certainly smile response significant individual entire movie red father century marriage listen.","23:03:01"
"5","35","3","Particular person reveal sense campaign return detail.","19:34:07"
"43","41","2","Recognize bad everything dinner measure certain toward power.","15:42:48"
"26","11","2","Alone parent pick nothing specific fact rule.","20:25:09"
"43","9","3","Arrive end far four outside one clearly sit.","15:13:08"
"26","0","1","Represent human think long account program style ok born material rest see.","10:45:35"
"31","22","4","Picture usually value six ahead single bank.","23:07:12"
"8","1","4","Without blood room available house change Mr.","01:24:21"
"5","0","2","Red plan beyond space figure feel world pretty.","05:28:28"
"18","44","3","High picture decade rule school dog debate less full later.","21:21:37"
"8","38","1","Thing concern sea affect training contain officer total away film mission of until.","01:58:48"
"26","26","4","Professor fish lay seem such garden recent stop message already.","15:17:04"
"31","17","5","Carry town husband forward interview however simply well news myself yes without.","23:28:22"
"43","20","4","Pm last two young prevent they Republican low fly evening.","09:21:51"
"40","48","5","Trip contain contain student finish by sell actually state cut task choice.","23:47:50"
"40","28","5","Agree national cost believe low there final Democrat since approach manager capital.","03:54:39"
"40","3","3","Reveal follow commercial here energy appear whatever seek American manager political adult.","17:08:39"
"40","41","5","Cultural green avoid finish radio bed talk own director class against of.","09:12:36"
"32","10","3","She too ever follow girl beyond professor late consider nature reduce personal language.","13:28:10"
"31","13","4","Create own same race claim point sea lay stop.","19:14:36"
"26","5","3","Front skin arrive light situation him.","18:20:04"
"26","45","5","Matter film kind explain would despite young commercial all.","12:44:11"
"32","49","5","Full water thousand rich travel song.","06:32:13"
"43","10","2","Machine west choose about food they.","17:32:17"
"5","20","3","Forward raise myself fund position relationship pull large against.","10:32:23"
"18","19","5","Where protect feeling such third summer pressure under.","18:59:34"
"43","5","1","Nature table same administration really example pretty hotel view new free knowledge throughout.","04:51:59"
"1","17","3","Yet cultural purpose create guy same ago job peace result bring leave argue.","16:15:02"
"26","28","4","Religious history goal discover middle form impact land kitchen stop fall.","08:45:31"
"32","22","4","Lot large might candidate apply describe for line perform.","17:08:21"
"5","36","4","Unit program enter music natural everyone including admit health.","08:39:06"
"40","36","3","Employee discover investment try would computer really push.","12:29:13"
"43","34","5","Song environmental represent become again recent.","00:58:36"
"18","1","2","Sort make provide green case participant peace agent dream week building lose other.","14:48:29"
"43","0","5","Available add figure vote conference leg word.","23:06:48"
"31","28","1","Result imagine condition somebody owner performance ever instead sell entire occur test somebody.","18:14:53"
"32","15","5","Term say reflect few happen tell board.","07:54:12"
